rating,acidity_structure,aftertaste,aroma,body,flavor,agtron,coffee_origin,est_price,roast_level,roaster,roaster_location
94,,8.0,9.0,9.0,9.0,52/68,"Panama; Sidamo and Yirgacheffe growing regions, southern Ethiopia; Bolivia; Brazil.",NT $520/225 grams,Medium,Big Nose Cafe,"Hsinchu City, Taiwan"
91,,8.0,9.0,8.0,8.0,45/55,Costa Rica; Sumatra.,CAD $15.99/16 ounces,Medium-Dark,Fresh Cup Roastery Cafe,"Victoria, British Columbia, Canada"
92,,8.0,8.0,9.0,9.0,64/83,Not disclosed.,NTD $320/8 ounces,Light,Cama Cafe,"Taipei, Taiwan"
93,,8.0,9.0,9.0,9.0,58/78,"Huehuetenango growing region, Guatemala.",$18.00/12 ounces,Medium-Light,Temple Coffee and Tea,"Sacramento, California"
93,,8.0,9.0,9.0,9.0,66/85,"Huehuetenango growing region, Guatemala.",$16.50/12 ounces,Light,Temple Coffee and Tea,"Sacramento, California"
94,,9.0,9.0,9.0,9.0,54/70,"Lintong growing region, North Sumatra Province, Indonesia.",$18.00/12 ounces,Medium-Light,Temple Coffee and Tea,"Sacramento, California"
95,,8.0,10.0,9.0,9.0,63/81,"Santa Clara, Panama.",$17.50/12 ounces,Light,Temple Coffee and Tea,"Sacramento, California"
93,,8.0,8.0,9.0,9.0,60/88,"Yirgacheffe growing region, south-central Ethiopia.",NTD $1000/16 ounces,Light,Bartok Coffee,"Taipei City, Taiwan"
92,,8.0,9.0,8.0,9.0,63/88,"Boquete growing region, Chiriqui Province, western Panama.",$17.75/12 ounces,Light,Wild Goose Coffee Roasters,"Redlands, California"
93,,8.0,9.0,8.0,9.0,68/89,"Yirgacheffe growing region, southern Ethiopia.",NTD $800/227 grams,Light,Comestible Master Company,"Taichung, Taiwan"
94,,8.0,9.0,9.0,9.0,66/99,"Yirgacheffe growing region, southern Ethiopia.",NTD $600/227 grams,Light,Comestible Master Company,"Taichung, Taiwan"
91,,8.0,8.0,8.0,9.0,64/89,"Eastern slopes of Volcan Baru, western Panama.",$20.00/12 ounces,Light,Temple Coffee and Tea,"Sacramento, California"
93,,8.0,9.0,8.0,9.0,62/84,"Yirgacheffe growing region, southern Ethiopia.",$14.75/12 ounces,Light,BeanFruit Coffee Co.,"Jackson, Mississippi"
94,,9.0,9.0,9.0,9.0,68/92,"Central Valley, Costa Rica.",$19.00/12 ounces,Light,Temple Coffee and Tea,"Sacramento, California"
93,,8.0,9.0,9.0,9.0,55/72,"Nyamasheke District, Rwanda.",$18.50/12 ounces,Medium-Light,Wild Goose Coffee Roasters,"Redlands, California"
92,,8.0,9.0,8.0,9.0,46/56,Colombia,"NT $2,000/16 ounces",Medium,Simon Hsieh's Aroma Roast Coffees,"Taoyuan City, Taiwan"
93,,8.0,9.0,8.0,9.0,44/57,Costa Rica,"NT $1,100/16 ounces",Medium-Dark,Simon Hsieh's Aroma Roast Coffees,"Taoyuan City, Taiwan"
94,,8.0,9.0,9.0,9.0,47/56,Colombia,"NT $2,000/16 ounces",Medium,Simon Hsieh's Aroma Roast Coffees,"Taoyuan City, Taiwan"
91,,7.0,8.0,9.0,9.0,58/72,"Kainantu district, Eastern Highlands Province, Papua New Guinea.",$16.50/12 ounces,Medium-Light,Wild Goose Coffee Roasters,"Redlands, California"
92,,8.0,9.0,8.0,9.0,62/88,"Kalehe, Southern Kivu, Democratic Republic of the Congo.",$13.49/12 ounces,Light,Red Rooster Coffee Roaster,"Floyd, Virginia"
92,,8.0,9.0,8.0,9.0,65/85,"Nariño Department, southern Colombia.",$17.00/12 ounces,Light,Red Rooster Coffee Roaster,"Floyd, Virginia"
93,,8.0,9.0,8.0,9.0,55/67,Northern Burundi,$18.00/12 ounces,Medium-Light,Cafe Grumpy,"Brooklyn, New York"
93,,8.0,9.0,8.0,9.0,64/90,"Nariño Department, Colombia.",$21.00/16 ounces,Light,Seasons Coffee Roasters,"Sacramento, California"
93,,8.0,9.0,9.0,9.0,55/74,"Mbeya Region, Tanzania.",$16.00/12 ounces,Medium-Light,Cafe Grumpy,"Brooklyn, New York"
94,,8.0,9.0,9.0,9.0,55/72,Kenya; Brazil.,$16.00/16 ounces,Medium-Light,Propeller Coffee,"Toronto, Ontario, Canada"
94,,8.0,9.0,8.0,10.0,62/88,"Yirgacheffe growing region, southern Ethiopia.",$24.00/16 ounces,Light,Seasons Coffee Roasters,"Sacramento, California"
91,,7.0,9.0,8.0,9.0,40/46,Not disclosed.,NT $255/8 ounces,Medium-Dark,Cama Cafe,"Taipei, Taiwan"
90,,8.0,8.0,8.0,8.0,50/69,"Veracruz State, Mexico.",$13.99/12 ounces,Medium,Mystic Monk Coffee,"Clark, Wyoming"
94,,9.0,9.0,8.0,9.0,61/79,"Limu Woreda, southwest Ethiopia.",$17.00/16 ounces,Medium-Light,Kakalove Cafe,"Chia-Yi, Taiwan"
85,,7.0,7.0,7.0,7.0,41/45,"Southern Minas Gerais State, Brazil.",$13.20/8 ounces,Medium-Dark,Starbucks Reserve Roastery,"Seattle, Washington"
87,,7.0,8.0,7.0,8.0,39/46,"Kona growing region, “Big Island” of Hawaii.",$34.50/8.8 ounces,Medium-Dark,Starbucks Reserve Roastery,"Seattle, Washington"
91,,8.0,8.0,8.0,9.0,62/83,"Kayanza Province, northern Burundi.",$13.00/8 ounces,Light,Blue Bottle Coffee,"Oakland, California"
91,,8.0,8.0,8.0,9.0,58/65,Colombia,$12.99/12 ounces,Medium-Light,Allegro Coffee Roasters,"Berkeley, California"
92,,8.0,9.0,8.0,9.0,48/55,"Mantiqeiras de Minas growing region, Minas Gerais State, Brazil.",$40.00/8 ounces,Medium,Starbucks Reserve Roastery,"Seattle, Washington"
93,,8.0,9.0,8.0,9.0,57/68,"Caldas Department, Colombia.",$16.50/12 ounces,Medium-Light,Victrola Coffee Roasters,"Seattle, Washington"
93,,8.0,9.0,9.0,9.0,66/88,"Nyanza region, Rwanda.",$11.00/8 ounces,Light,Blue Bottle Coffee,"Oakland, California"
93,,8.0,9.0,8.0,9.0,60/74,"Nyeri County, Central Highlands, Kenya.",$12.99/12 ounces,Medium-Light,Allegro Coffee Roasters,"Berkeley, California"
95,,9.0,9.0,9.0,9.0,57/78,"Guji Zone, Sidama Province, southern Ethiopia.",$19.00/12 ounces,Medium-Light,Victrola Coffee Roasters,"Seattle, Washington"
92,,8.0,9.0,9.0,8.0,51/75,"Santa Rosa growing region, Guatemala.",$14.99/12 ounces,Medium-Light,Shearwater Organic Coffee Roasters,"Trumbull, Connecticut"
94,,9.0,9.0,9.0,9.0,78/99,"El Boqueron, Volcan de San Salvador, El Salvador.",$18.99/12 ounces,Light,Bird Rock Coffee Roasters,"La Jolla, California"
92,,8.0,9.0,8.0,9.0,56/76,"Quiche Department, Guatemala.",$14.75/12 ounces,Medium-Light,BeanFruit Coffee Co.,"Jackson, Mississippi"
94,,9.0,9.0,8.0,9.0,54/74,"Haraz (also spelled Haraaz) growing region, north-central Yemen",$19.00/8 ounces,Medium-Light,Dragonfly Coffee Roasters,"Boulder, Colorado"
94,,8.0,9.0,9.0,9.0,65/87,"Yirgacheffe growing region, south-central Ethiopia.",$15.00/12 ounces,Light,Flight Coffee Co.,"Bedford, New Hampshire"
91,,8.0,8.0,8.0,9.0,50/67,"Yirgacheffe growing region, southern Ethiopia.",$24.00/16 ounces,Medium,The WestBean Coffee Roasters,"San Diego, California"
94,,8.0,9.0,9.0,9.0,54/74,"Kayanza Province, northern Burundi.",$21.00/12 ounces,Medium-Light,Victrola Coffee Roasters,"Seattle, Washington"
93,,8.0,8.0,9.0,9.0,51/62,Not disclosed.,NTD $500/220 grams,Medium,Rufous Coffee,"Taipei, Taiwan"
96,,8.0,10.0,9.0,10.0,54/76,"Nyeri growing region, south-central Kenya.",$24.95/12 ounces,Medium-Light,Klatch Coffee,"Los Angeles, California"
92,,8.0,9.0,8.0,9.0,52/77,"Arusha growing region, Mt. Meru, Tanzania.",$13.25/12 ounces,Medium-Light,Lexington Coffee Roasters,"Lexington, Virginia"
93,,8.0,9.0,9.0,9.0,63/85,"Huila Department, southern Colombia.",$13.75/12 ounces,Light,Lexington Coffee Roasters,"Lexington, Virginia"
90,,8.0,8.0,8.0,8.0,47/67,Southern Ethiopia; Central America.,$14.30/12 ounces,Medium,Geisha Coffee Roaster,"Longwood, Florida"
91,,8.0,8.0,9.0,8.0,60/80,Not disclosed.,$16.00/12 ounces,Medium-Light,PT's Coffee Roasting Co.,"Topeka, Kansas"
91,,8.0,8.0,8.0,9.0,52/67,"Yirgacheffe growing region, southern Ethiopia; West Java, Indonesia.",$16.00/12 ounces,Medium,Tony's Coffees and Teas,"Bellingham, Washington"
91,,8.0,8.0,8.0,9.0,53/67,"Southern Ethiopia; Mexico; northern Sumatra, Indonesia.",$14.00/16 ounces,Medium,Roast House,"Spokane, Washington"
92,,8.0,9.0,8.0,9.0,48/59,"Southwestern Ethiopia; northern Sumatra, Indonesia.",$13.95/12 ounces,Medium,Paradise Roasters,"Ramsey, Minnesota"
92,,8.0,9.0,8.0,9.0,58/70,East and Central Africa.,$14.99/12 ounces,Medium-Light,Giv COFFEE,"Torrington, Connecticut"
93,,8.0,9.0,9.0,9.0,61/82,"Boquete growing region, Panama; Boke, Gamo Gofa Zone, southern Ethiopia.",$18.50/12 ounces,Light,Temple Coffee and Tea,"Sacramento, California"
94,,9.0,9.0,9.0,9.0,55/69,"Oromia region, southern Ethiopia; Mandheling growing region, northern Sumatra, Indonesia.",$14.00/12 ounces,Medium-Light,Modern Times,"San Diego, California"
93,,8.0,9.0,8.0,9.0,45/62,"Mogiana growing region, São Paulo State, Brazil; Guatemala; other Central America origins.",$29.99/2.2 pounds,Medium,Testa Rossa,"Belluno, Italy"
91,,7.0,9.0,8.0,9.0,51/64,"Sidamo (also Sidama) growing region, southern Ethiopia.",$16.95/12 ounces,Medium,Paradise Roasters,"Ramsey, Minnesota"
92,,8.0,9.0,8.0,9.0,58/80,"Yirgacheffe growing region, southern Ethiopia.",$18.99/12 ounces,Medium-Light,Bird Rock Coffee Roasters,"La Jolla, California"
94,,8.0,9.0,9.0,9.0,47/60,"Carmo de Minas growing region, Minas Gerais State, Brazil.",$12.95/12 ounces,Medium,Paradise Roasters,"Ramsey, Minnesota"
89,,7.0,8.0,8.0,8.0,49/58,Not disclosed.,$9.99/16 ounces,Medium,Ara Azzurro,"Ontario, Canada"
90,,7.0,9.0,8.0,9.0,43/51,"Yirgacheffe growing region, southern Ethiopia.",$18.00/12 ounces,Medium-Dark,Caffe Luxxe,"Santa Monica, California"
92,,8.0,8.0,9.0,8.0,52/62,"Sidama, southern Ethiopia; Pangoa, Peru; Yungas, Bolivia.",CAD $11.00/10.5 ounces,Medium,Level Ground Trading,"Victoria, British Columbia, Canada"
97,,9.0,10.0,9.0,10.0,52/66,"Chiriqui, western Panama.",$59.95/8 ounces,Medium,JBC Coffee Roasters,"Madison, Wisconsin"
91,,8.0,8.0,8.0,8.0,67/92,"Sidama (also Sidamo) growing region, southern Ethiopia.",$17.50/12 ounces,Light,Chocolate Fish Coffee Roasters,"Sacramento, California"
91,,8.0,9.0,8.0,9.0,55/77,"Quiche Department, Guatemala.",$13.95/12 ounces,Medium-Light,Lexington Coffee Roasters,"Lexington, Virginia"
93,,9.0,9.0,8.0,9.0,50/66,"Sidama (also Sidamo) growing region, southern Ethiopia.",$15.15/12 ounces,Medium,Kean Coffee,"Newport Beach, California"
93,,9.0,9.0,8.0,9.0,66/91,"Muramvya Province, Burundi.",$17.50/16 ounces,Light,Kakalove Cafe,"Chia-Yi, Taiwan"
94,,8.0,9.0,9.0,9.0,48/60,Not disclosed.,$14.95/12 ounces,Medium,Kean Coffee,"Newport Beach, California"
84,,6.0,7.0,7.0,7.0,34/43,Various Latin American origins.,$12.95/12 ounces,Dark,Starbucks Reserve Roastery,"Seattle, Washington"
89,,8.0,8.0,8.0,8.0,46/66,Not disclosed.,$15.00/12 ounces,Medium,Water Avenue Coffee,"Portland, Oregon"
89,,7.0,8.0,8.0,8.0,49/71,"Sidama (also Sidamo) growing region, southern Ethiopia.",$16.30/12 ounces,Medium,Olympia Coffee Roasting,"Olympia, Washington"
92,,8.0,8.0,9.0,9.0,46/68,"Colima State, southwestern Mexico.",$16.50/12 ounces,Medium,PT's Coffee Roasting Co.,"Topeka, Kansas"
93,,9.0,9.0,8.0,9.0,48/69,"Sidamo (also Sidama) growing region, southern Ethiopia.",$19.50/12 ounces,Medium,Old Soul Co.,"Sacramento, California"
92,,8.0,9.0,8.0,9.0,53/74,"Oromia, Sidama (also Sidamo) growing region, southern Ethiopia.",$20.00/12 ounces,Medium-Light,Cafe Grumpy,"Brooklyn, New York"
96,,9.0,10.0,9.0,10.0,58/72,"Boquete growing region, western Panama.",$40.00/8 ounces,Medium-Light,Temple Coffee and Tea,"Sacramento, California"
91,,7.0,9.0,8.0,9.0,37/54,Ethiopia; Brazil; Indonesia.,$16.00/12 ounces,Medium-Dark,Caffe Luxxe,"Santa Monica, California"
93,,8.0,9.0,9.0,9.0,54/75,"Hambela district, Oromia growing region, southern Ethiopia.",$15.95/12 ounces,Medium-Light,Klatch Coffee,"Los Angeles, California"
91,,7.0,8.0,9.0,9.0,48/64,"Yirgacheffe growing region, southern Ethiopia.",$17.00/12 ounces,Medium,Flattop Coffee Roastery,"Estes Park, Colorado"
92,,8.0,8.0,8.0,9.0,52/71,"Guji Zone, Oromia Region, Sidamo growing region, south-central Ethiopia.",$14.95/12 ounces,Medium-Light,Paradise Roasters,"Ramsey, Minnesota"
93,,8.0,9.0,9.0,8.0,47/60,Brazil; Ethiopia; Costa Rica.,$12.95/12 ounces,Medium,Paradise Roasters,"Ramsey, Minnesota"
93,,8.0,9.0,8.0,9.0,53/64,Burundi; Brazil; Colombia.,$22.00/36 ounces,Medium,Noelia Coffee,"Paju City (Gyeonggi-do), South Korea"
92,,8.0,9.0,8.0,9.0,58/69,"Chimaltenango Department, Guatemala.",$13.50/12 ounces,Medium-Light,Greater Goods Coffee Roasters,"Austin, Texas"
94,,8.0,9.0,9.0,9.0,57/76,"Yirgacheffe growing region, southern Ethiopia.",$15.00/8 ounces,Medium-Light,Coffee Factorial,"San Diego, California"
90,,8.0,8.0,8.0,9.0,48/60,South-central Kenya.,$16.00/12 ounces,Medium,Rex Roasting,"Terre Haute, Indiana"
92,,8.0,9.0,8.0,9.0,56/64,"Yirgacheffe growing region, southern Ethiopia.",$15.90/12 ounces,Medium,JBC Coffee Roasters,"Madison, Wisconsin"
87,,7.0,8.0,7.0,8.0,55/68,Brazil.,NTD $370/16 ounces,Medium-Light,"Seeker Co, Ltd.","Taipei, Taiwan"
90,,7.0,9.0,8.0,8.0,49/60,Brazil.,NTD $465/16 ounces,Medium,"Seeker Co, Ltd.","Taipei, Taiwan"
91,,8.0,8.0,9.0,8.0,53/70,"Lintong growing region, North Sumatra Province, Indonesia.",$18.00/12 ounces,Medium-Light,Green Dragon Coffee,"Pittsburgh, Pennsylvania"
92,,8.0,8.0,8.0,9.0,57/83,"Boquete growing region, western Panama",$18.00/12 ounces,Medium-Light,Dragonfly Coffee Roasters,"Boulder, Colorado"
93,,8.0,9.0,9.0,9.0,53/70,"Ka’u growing region, Big Island of Hawaii.",$24.00/8 ounces,Medium-Light,Rusty's Hawaiian Coffee,"Pahala, Hawaii"
92,,8.0,9.0,8.0,9.0,55/70,"Kirinyaga growing district, south-central Kenya.",NTD $600/300 grams,Medium-Light,Gavagai,"Kaohsiung City, Taiwan"
92,,8.0,8.0,9.0,9.0,60/79,South-central Kenya.,NTD $1000/16 ounces,Medium-Light,Bartok Coffee,"Taipei City, Taiwan"
92,,8.0,9.0,8.0,9.0,53/70,"Kisii (also Gusii) Highlands, southwestern Kenya.",$17.99/12 ounces,Medium-Light,Abundancia Kenyan Coffee,"Portland, Oregon"
92,,8.0,9.0,8.0,9.0,55/75,"Kiambu County, south-central Kenya.",$18.50/12 ounces,Medium-Light,Temple Coffee and Tea,"Sacramento, California"
92,,8.0,8.0,9.0,9.0,61/77,"Kirinyaga growing district, central Kenya.",$14.50/12 ounces,Medium-Light,Flight Coffee Co.,"Bedford, New Hampshire"
93,,8.0,9.0,8.0,9.0,59/67,South-central Kenya.,$16.00/12 ounces,Medium-Light,Propeller Coffee,"Toronto, Ontario, Canada"
93,,8.0,9.0,9.0,9.0,59/78,"Kiambu County, south-central Kenya.",$11.00/8 ounces,Medium-Light,Pebble Coffee,"Taipei, Taiwan"
93,,8.0,9.0,8.0,9.0,64/77,"Embu County, south-central Kenya.",$18.50/12 ounces,Medium-Light,Wonderstate Coffee,"Driftless, Wisconsin"
93,,9.0,8.0,8.0,9.0,55/69,"Thika growing region, central Kenya.",$15.00/8 ounces,Medium-Light,Coffee Factorial,"San Diego, California"
95,,9.0,9.0,9.0,9.0,59/75,"Nyeri County, Central Highlands, Kenya.",$17.99/16 ounces,Medium-Light,Willoughby's Coffee & Tea,"Branford, Connecticut"
95,,9.0,9.0,9.0,9.0,54/70,"Kiambu County, south-central Kenya.",$17.50/12 ounces,Medium-Light,Giv COFFEE,"Torrington, Connecticut"
93,,8.0,9.0,8.0,9.0,38/43,Guatemala; Colombia; Costa Rica; Ethiopia; Kenya.,$16.00/16 ounces,Dark,Cafe de Fiore,"Hsinchu, Taiwan"
93,,8.0,9.0,8.0,9.0,60/77,"Santa Ana growing region, El Salvador.",$15.99/12 ounces,Medium-Light,Topeca Coffee Roasters,"Tulsa, Oklahoma"
94,,8.0,9.0,9.0,9.0,60/75,"Kirinyaga growing district, south-central Kenya.",$15.25/12 ounces,Medium-Light,BeanFruit Coffee Co.,"Jackson, Mississippi"
94,,8.0,9.0,9.0,9.0,58/71,"Guji Zone, Sidama Province, southern Ethiopia.",$15.00,Medium-Light,Illuminista Coffee Roasters,"Lake, Michigan"
92,,8.0,9.0,8.0,9.0,62/88,Not disclosed.,$15.95/12 ounces,Light,Crimson Cup Coffee & Tea,"Columbus, Ohio"
93,,8.0,10.0,8.0,9.0,60/83,"Yirgacheffe growing region, southern Ethiopia",$20.00/10 ounces (free shipping),Light,Pachamama Coffee Cooperative,"Sacramento, California"
96,,9.0,9.0,9.0,10.0,67/88,"Cañas Verdes, Boquete growing region, western Panama.",$51.00/8 ounces,Light,Bird Rock Coffee Roasters,"La Jolla, California"
90,,8.0,8.0,8.0,9.0,52/69,"Sidama (also Sidamo) growing region, southern Ethiopia.",$12.99/12 ounces,Medium,Red Rooster Coffee Roaster,"Floyd, Virginia"
95,,9.0,9.0,9.0,9.0,55/76,"Nyeri County, Central Highlands, Kenya.",$14.40/12 ounces,Medium-Light,Topeca Coffee Roasters,"Tulsa, Oklahoma"
94,,8.0,9.0,9.0,9.0,55/78,"Hambela district, Oromia growing region, southern Ethiopia",$18.95/12 ounces,Medium-Light,Lexington Coffee Roasters,"Lexington, Virginia"
93,,8.0,9.0,8.0,9.0,56/69,Northern Burundi,$24.00/10 ounces,Medium-Light,Big Shoulders Coffee,"Chicago, Illinois"
93,,8.0,9.0,9.0,9.0,62/84,"Yirgacheffe growing region, southern Ethiopia.",$17.95/12 ounces,Light,Chocolate Fish Coffee Roasters,"Sacramento, California"
94,,8.0,9.0,9.0,9.0,44/50,Ecuador.,"NT $2,000/16 ounces",Medium-Dark,Simon Hsieh's Aroma Roast Coffees,"Taoyuan City, Taiwan"
95,,9.0,9.0,9.0,9.0,43/52,Rwanda.,"NT $1,200/16 ounces",Medium-Dark,Simon Hsieh's Aroma Roast Coffees,"Taoyuan City, Taiwan"
89,,7.0,8.0,8.0,8.0,50/61,"Blue Mountain growing region, eastern Jamaica.",$32.00/8 ounces,Medium,Stoneleigh Coffee,"Toronto, Ontario, Canada"
95,,9.0,9.0,9.0,9.0,66/87,"Jimma Zone, Oromia State, Ethiopia",$20.00/12 ounces,Light,Crimson Cup Coffee & Tea,"Columbus, Ohio"
91,,8.0,8.0,8.0,9.0,61/84,"West Valley, Costa Rica",$30.60/200 grams,Light,Coffee Roasters Avenue,"Seoul, South Korea"
92,,8.0,9.0,8.0,9.0,53/71,"Santa Barbara Department, Honduras",$18.75/12 ounces,Medium-Light,Victrola Coffee Roasters,"Seattle, Washington"
92,,8.0,8.0,8.0,9.0,59/81,"Huehuetenango growing region, western Guatemala.",$15.95/12 ounces,Medium-Light,Wonderstate Coffee,"Driftless, Wisconsin"
92,,8.0,9.0,8.0,9.0,56/69,"Huehuetenango growing region, Guatemala",$49.95/8 ounces,Medium-Light,Equator Coffees & Teas,"San Rafael, California"
92,,8.0,8.0,9.0,9.0,58/74,"Huehuetenango growing region, Guatemala",$18.00/12 ounces,Medium-Light,Dragonfly Coffee Roasters,"Boulder, Colorado"
92,,8.0,9.0,8.0,9.0,61/80,"Palencia, Fraijanes Plateau growing region, central Guatemala",$23.99/12 ounces,Medium-Light,Bird Rock Coffee Roasters,"La Jolla, California"
92,,8.0,9.0,8.0,9.0,50/69,"Boquete growing region, western Panama",$20.00/250 grams,Medium,Old Soul Co.,"Sacramento, California"
94,,8.0,9.0,9.0,9.0,62/87,"Chalatenango growing region, northwestern El Salvador","KRW 40,000/500 grams",Light,Namusairo Coffee,"Seoul, South Korea"
88,,7.0,8.0,8.0,8.0,62/79,"Chipinge growing region, eastern Zimbabwe.",$10.00/8 ounces,Medium-Light,Green Dragon Coffee,"Pittsburgh, Pennsylvania"
93,,9.0,9.0,8.0,9.0,55/76,"Yirgacheffe growing region, southern Ethiopia",$15.90/12 ounces,Medium-Light,JBC Coffee Roasters,"Madison, Wisconsin"
95,,9.0,9.0,9.0,9.0,57/78,"Santa Maria de Dota valley, Tarrazu growing region, Costa Rica",$15.80/12 ounces,Medium-Light,JBC Coffee Roasters,"Madison, Wisconsin"
90,,8.0,8.0,9.0,8.0,50/69,"Huehuetenango growing region, Guatemala",$20.00/12 ounces,Medium,Bird Rock Coffee Roasters,"San Diego, California"
90,,8.0,8.0,8.0,8.0,61/80,"Santa Ana growing region, El Salvador",$15.75/12 ounces,Medium-Light,JBC Coffee Roasters,"Madison, Wisconsin"
93,,9.0,9.0,8.0,9.0,60/80,"Hambela District, Oromia growing region, southern Ethiopia",$16.80/12 ounces,Medium-Light,JBC Coffee Roasters,"Madison, Wisconsin"
94,,8.0,9.0,9.0,9.0,56/74,"Nyeri County, Central Highlands, Kenya",$16.10/12 ounces,Medium-Light,JBC Coffee Roasters,"Madison, Wisconsin"
96,,8.0,10.0,8.0,10.0,48/59,"Boquete growing region, western Panama",$19.50/12 ounces,Medium,Temple Coffee and Tea,"Sacramento, California"
91,,7.0,9.0,8.0,9.0,46/58,"Yirgacheffe growing region, southern Ethiopia",$17.00/12 ounces,Medium,Big Creek Coffee Roasters,"Hamilton, Montana"
91,,8.0,8.0,8.0,9.0,46/55,"Oromia growing region, southern Ethiopia",$16.50/12 ounces,Medium-Dark,Big Creek Coffee Roasters,"Hamilton, Montana"
92,,8.0,9.0,8.0,9.0,47/54,South-central Kenya,$18.00/12 ounces,Medium-Dark,Big Creek Coffee Roasters,"Hamilton, Montana"
93,,9.0,9.0,8.0,9.0,54/71,"Southern Tolima Department, west-central Colombia",$14.75/12 ounces,Medium-Light,BeanFruit Coffee Co.,"Jackson, Mississippi"
94,,9.0,9.0,8.0,9.0,58/76,"Limu growing region, western Ethiopia",$16.95/12 ounces,Medium-Light,Barrington Coffee Roasting Co.,"Lee, Massachusetts"
94,,9.0,9.0,9.0,9.0,52/72,"Wellega, Sidama and Yirgacheffe growing regions, southern and western Ethiopia",$25.95/12 ounces,Medium-Light,Barrington Coffee Roasting Co.,"Lee, Massachusetts"
92,,8.0,9.0,8.0,9.0,55/66,"Alajuela growing region, Central Valley, Costa Rica",$19.00/12 ounces,Medium,Cafe Virtuoso,"San Diego, California"
92,,8.0,9.0,8.0,9.0,55/64,Brazil; Colombia; Ethiopia,$16.00/12 ounces,Medium,Cafe Virtuoso,"San Diego, California"
94,,8.0,9.0,9.0,9.0,52/60,Not disclosed.,$15.00/12 ounces,Medium,Cafe Virtuoso,"San Diego, California"
92,,8.0,9.0,8.0,9.0,60/81,"Kona growing region, Big Island of Hawaii",$32.50/165 grams,Medium-Light,The Coffee Academics,"Hong Kong, China"
93,,8.0,9.0,9.0,9.0,59/76,"Yirgacheffe growing region, southern Ethiopia",$15.00/8 ounces,Medium-Light,Coffee Factorial,"San Diego, California"
96,,9.0,10.0,9.0,9.0,49/72,"Boquete growing region, western Panama",$49.95/8 ounces,Medium,Klatch Coffee,"Los Angeles, California"
88,,7.0,7.0,8.0,8.0,48/61,Guatemala; Indonesia; Mexico,$16.00/16 ounces,Medium,Roast House,"Spokane, Washington"
88,,8.0,7.0,8.0,8.0,50/64,"Ocotepeque Department, Honduras",$12.99/12 ounces,Medium,Magnolia Coffee,"Charlotte, North Carolina"
90,,7.0,9.0,8.0,8.0,51/66,"Huehuetenango growing region, Guatemala",$12.95/12 ounces,Medium,Paradise Roasters,"Ramsey, Minnesota"
90,,8.0,8.0,8.0,8.0,68/89,"Inambari Valley, Peru",$16.50/12 ounces,Light,Giv COFFEE,"Torrington, Connecticut"
90,,8.0,8.0,8.0,8.0,51/73,"Huehuetenango growing region, Guatemala",$14.15/12 ounces,Medium-Light,Ghost Town Coffee Roasters,"Bozeman, Montana"
91,,8.0,8.0,8.0,9.0,60/82,"Gedeb District, Yirgacheffe growing region, southern Ethiopia",$15.00/12 ounces,Light,Greater Goods Coffee Roasters,"Austin, Texas"
91,,8.0,8.0,8.0,9.0,61/87,"Gedeo zone, southern Ethiopia",$16.50/12 ounces,Light,Thanksgiving Coffee,"Fort Bragg, California"
91,,8.0,8.0,8.0,9.0,51/61,"Yirgacheffe growing region, southern Ethiopia",$11.75/12 ounces,Medium,Grounds for Change,"Poulsbo, Washington"
92,,8.0,9.0,8.0,9.0,57/80,"Yirgacheffe growing region, southern Ethiopia",$17.00/12 ounces,Medium-Light,Thanksgiving Coffee,"Fort Bragg, California"
93,,8.0,9.0,8.0,9.0,54/59,"Yirgacheffe growing region, southern Ethiopia",$16.85/12 ounces,Medium,Ghost Town Coffee Roasters,"Bozeman, Montana"
93,,8.0,9.0,9.0,9.0,69/91,"Huehuetenango growing region, Guatemala",$16.95/12 ounces,Light,Barrington Coffee Roasting Co.,"Lee, Massachusetts"
93,,8.0,9.0,8.0,9.0,68/87,"Silla Del Pando, Volcan, Panama",$82.45/12 ounces,Light,Barrington Coffee Roasting Co.,"Lee, Massachusetts"
94,,9.0,9.0,8.0,9.0,60/78,"Kiambu growing region, south-central Kenya.",$17.95/12 ounces,Medium-Light,Barrington Coffee Roasting Co.,"Lee, Massachusetts"
89,,7.0,8.0,8.0,8.0,54/59,"Yauco growing region, central Puerto Rico",$14.00/8 ounces,Medium,Cafe El Meson,"Hormigueros, Puerto Rico"
89,,8.0,8.0,8.0,8.0,56/77,"Champasak Province, southern Laos",$13.71/200 grams,Medium-Light,Lao Mountain Coffee,"Vientiane, Laos"
90,,7.0,9.0,8.0,8.0,59/73,"Jinotega, Nicaragua",NTD $800/227 grams,Medium-Light,Finca Tres Soles,"Taipei, Taiwan"
90,,8.0,8.0,8.0,8.0,59/73,"Jinotega, Nicaragua",NT $450/227 grams,Medium-Light,Finca Tres Soles,"Taipei, Taiwan"
92,,8.0,9.0,8.0,9.0,61/84,Nicaragua,$21.00/12 ounces,Light,Dragonfly Coffee Roasters,"Boulder, Colorado"
95,,9.0,9.0,9.0,9.0,63/91,"Nueva Segovia, Nicaragua",$18.00/12 ounces,Light,Dragonfly Coffee Roasters,"Boulder, Colorado"
93,,9.0,9.0,8.0,9.0,60/78,"Yirgacheffe growing region, south-central Ethiopia",$17.75/12 ounces,Medium-Light,Wonderstate Coffee,"Driftless, Wisconsin"
93,,8.0,9.0,8.0,9.0,57/74,"Valle del Cauca growing region, Colombia",$15.75/12 ounces,Medium-Light,Wonderstate Coffee,"Driftless, Wisconsin"
90,,7.0,9.0,8.0,8.0,56/66,"Nariño Department, southern Colombia",$18.00/16 ounces,Medium-Light,The WestBean Coffee Roasers,"San Diego, California"
91,,8.0,8.0,8.0,9.0,51/61,"Huehuetenango growing region, Guatemala",$11.35/12 ounces,Medium,Grounds for Change,"Poulsbo, Washington"
93,,9.0,9.0,8.0,9.0,34/52,"Tarrazu growing region, Costa Rica",CAD $19.95/10 ounces,Medium-Dark,Fresh Cup Roastery Cafe,"Victoria, British Columbia, Canada"
94,,8.0,9.0,9.0,9.0,63/85,"Central Valley, Costa Rica",$18.50/12 ounces,Light,Temple Coffee and Tea,"Sacramento, California"
95,,9.0,10.0,8.0,9.0,57/70,"Kirinyaga District, south-central Kenya",$21.00/12 ounces,Medium-Light,Temple Coffee and Tea,"Sacramento, California"
92,,8.0,9.0,8.0,9.0,63/87,"Yirgacheffe growing region, southern Ethiopia",$14.50/16 ounces,Light,Kakalove Cafe,"Chia-Yi, Taiwan"
92,,8.0,9.0,8.0,9.0,58/80,South-central Kenya,$19.95/12 ounces,Medium-Light,Lexington Coffee Roasters,"Lexington, Virginia"
92,,8.0,9.0,8.0,9.0,45/60,"Yirgacheffe growing region, southern Ethiopia",$14.95/12 ounces,Medium,Paradise Roasters,"Ramsey, Minnesota"
92,,8.0,9.0,8.0,9.0,52/72,"Hambela District, Oromia growing region, southern Ethiopia",$13.99/12 ounces,Medium-Light,Red Rooster Coffee Roaster,"Floyd, Virginia"
93,,8.0,9.0,9.0,9.0,68/94,"Volcan, Panama",$82.45/12 ounces,Light,Barrington Coffee Roasting Co.,"Lee, Massachusetts"
93,,9.0,9.0,8.0,9.0,58/79,Colombia,RMB $70/150 grams,Medium-Light,AHRIRE Roasting,"Pu'Er Yunnan Province, China"
93,,8.0,9.0,8.0,9.0,57/78,South-central Kenya.,$20.00/12 ounces,Medium-Light,Bootstrap Coffee Roasters,"St. Paul, Minnesota"
93,,8.0,9.0,9.0,9.0,52/71,"Hambela District, Oromia growing region, southern Ethiopia",$15.49/12 ounces,Medium-Light,Red Rooster Coffee Roaster,"Floyd, Virginia"
94,,8.0,9.0,9.0,9.0,59/79,"Apaneca, El Salvador",$18.75/12 ounces,Medium-Light,JBC Coffee Roasters,"Madison, Wisconsin"
95,,8.0,10.0,9.0,9.0,52/73,"Chiriqui, western Panama.",$49.95/8 ounces,Medium-Light,JBC Coffee Roasters,"Madison, Wisconsin"
94,,8.0,9.0,9.0,9.0,64/85,"Boquete growing region, western Panama",$48.00/8 ounces,Light,Bird Rock Coffee Roasters,"San Diego, California"
96,,9.0,9.0,9.0,10.0,63/74,"Sidamo (also Sidama) growing region, southern Ethiopia",RMB $235/125 grams,Medium-Light,AHRIRE Roasting,"Pu'Er Yunnan Province, China"
92,,8.0,9.0,8.0,9.0,61/80,"Jimma Zone, Oromia State, Ethiopia",$19.00/12 ounces,Medium-Light,Corvus Coffee Roasters,"Denver, Colorado"
