rating,acidity_structure,aftertaste,aroma,body,flavor,agtron,coffee_origin,est_price,roast_level,roaster,roaster_location
92,8.0,8.0,8.0,9.0,9.0,53/71,Ethiopia; Guatemala,$16.00/12 ounces,Medium-Light,Fidalgo Coffee,"Burlington, Washington"
95,9.0,9.0,9.0,9.0,10.0,58/74,"Embu County, Kenya",NT $580/200 grams,Medium-Light,GK Coffee,"Yilan, Taiwan"
85,7.0,7.0,7.0,7.0,7.0,44/58,"Bali, Indonesia",$14.99/12 ounces,Medium,Mooju Coffee,"Temecula, California"
92,8.0,8.0,9.0,8.0,9.0,52/68,"North Kona growing district, “Big Island” of Hawaii",$30.00/8 ounces,Medium,Hala Tree Kona Coffee,"Captain Cook, Hawaii"
92,8.0,8.0,9.0,8.0,9.0,52/70,Guatemala; Ethiopia,$17.50/12 ounces,Medium-Light,Oak & Bond Coffee Company,"Charlotte, North Carolina"
93,8.0,8.0,9.0,9.0,9.0,52/68,"Huehuetenango, Guatemala",$19.00/12 ounces,Medium,Oak & Bond Coffee Company,"Charlotte, North Carolina"
94,9.0,8.0,9.0,9.0,9.0,58/78,"Jambi Province, Sumatra, Indonesia",$17.80/12 ounces,Medium-Light,JBC Coffee Roasters,"Madison, Wisconsin"
94,9.0,8.0,9.0,9.0,9.0,58/74,"Agaro Gera, Jimma Zone, Oromia State, Ethiopia",$22.95/12 ounces,Medium-Light,Paradise Roasters,"Minneapolis, Minnesota"
93,8.0,8.0,9.0,9.0,9.0,52/68,"Kona growing region, Big Island of Hawai'i",$35.00/7 ounces,Medium,Rusty's Hawaiian,"Pahala, Hawaii"
93,8.0,8.0,9.0,9.0,9.0,52/70,"Ka’u growing region, Big Island of Hawai'i",$30.00/10 ounces,Medium-Light,Big Island Coffee Roasters,"Mountain View, Hawai'i"
94,9.0,8.0,9.0,9.0,9.0,54/68,"Ka’u growing region, Big Island of Hawai'i",$35.00/10 ounces,Medium-Light,Big Island Coffee Roasters,"Mountain View, Hawai'i"
93,9.0,8.0,9.0,8.0,9.0,60/76,Kenya,NT $400/8 ounces,Medium-Light,De Clieu Coffee,"Taipei, Taiwan"
92,8.0,8.0,9.0,8.0,9.0,50/66,"Gedeb District, Gedeo Zone, southern Ethiopia",NT $600/227 grams,Medium,Vennel Coffee,"Keelung, Taiwan"
93,8.0,8.0,9.0,9.0,9.0,53/70,"Nariño, Colombia",$19.00/12 ounces,Medium-Light,Bird Rock Coffee Roasters,"San Diego, California"
94,,9.0,9.0,8.0,9.0,0/0,"Boquete growing region, western Panama",£50.00/10 capsules,,Difference Coffee,"London, England"
93,8.0,8.0,9.0,9.0,9.0,56/74,"Antigua growing region, Guatemala",$17.00/12 ounces,Medium-Light,JBC Coffee Roasters,"Madison, Wisconsin"
95,9.0,9.0,9.0,9.0,9.0,58/78,"Inza, Cauca Department, Colombia",$18.00/12 ounces,Medium-Light,JBC Coffee Roasters,"Madison, Wisconsin"
96,,9.0,9.0,9.0,9.0,56/74,"Agaro Gera, Jimma Zone, Oromia State, Ethiopia",$18.75/12 ounces,Medium-Light,JBC Coffee Roasters,"Madison, Wisconsin"
92,8.0,8.0,9.0,8.0,9.0,54/72,"Alishan, Chia-Yi City, Taiwan",NT $400/4 ounces,Medium-Light,Kakalove Cafe,"Chia-Yi, Taiwan"
94,9.0,8.0,9.0,9.0,9.0,56/74,"Aceh Province, Sumatra, Indonesia",NT $225/8 ounces,Medium-Light,Kakalove Cafe,"Chia-Yi, Taiwan"
94,9.0,8.0,9.0,9.0,9.0,54/72,"Pantan Musara, Gayo, Sumatra, Indonesia",$24.95/12 ounces,Medium-Light,Paradise Roasters,"Minneapolis, Minnesota"
94,9.0,8.0,9.0,9.0,9.0,60/78,"Paéz, Cauca Department, Colombia",$12.00/8 ounces,Medium-Light,States Coffee & Mercantile,"Martinez, California"
94,9.0,8.0,9.0,9.0,9.0,58/76,"Yirgacheffe growing region, southern Ethiopia",$20.00/12 ounces,Medium-Light,Dragonfly Coffee Roasters,"Henderson, Nevada"
94,9.0,8.0,9.0,9.0,9.0,52/68,"Kona, Big Island of Hawai’i",$18.95/4 ounces,Medium,Paradise Roasters,"Minneapolis, Minnesota"
90,8.0,8.0,8.0,8.0,8.0,45/61,Brazil; Costa Rica,$10.00/12 ounces,Medium,Rhetoric Coffee,"Berkeley, California"
92,,8.0,9.0,8.0,8.0,47/63,"El Diamante, Jaén, Peru",$19.00/12 ounces,Medium,Temple Coffee Roasters,"Sacramento, California"
92,8.0,8.0,9.0,8.0,9.0,50/64,El Salvador; Peru,$13.50/12 ounces,Medium,Rhetoric Coffee,"Berkeley, California"
93,,8.0,9.0,8.0,9.0,50/68,Ethiopia; Nicaragua,NT $225/8 ounces,Medium,Kakalove Cafe,"Chia-Yi, Taiwan"
93,,9.0,9.0,8.0,9.0,58/74,"Huabal, Peru",$20.00/12 ounces,Medium-Light,Amavida Coffee Roasters,"Santa Rosa Beach, Florida"
93,9.0,8.0,9.0,8.0,9.0,54/72,"Nariño Department, southern Colombia",$17.00/12 ounces,Medium-Light,Revel Coffee,"Billings, Montana"
93,8.0,8.0,9.0,9.0,9.0,52/68,Brazil; Colombia; Ethiopia,$16.00/12 ounces,Medium,Rhetoric Coffee,"Berkeley, California"
94,9.0,8.0,9.0,9.0,9.0,58/74,"Aceh Province, Sumatra, Indonesia",$21.00/12 ounces,Medium-Light,Revel Coffee,"Billings, Montana"
94,9.0,8.0,9.0,9.0,9.0,52/68,"Agaro Gera, Jimma Zone, Oromia State, Ethiopia",$21.00/12 ounces,Medium,Temple Coffee Roasters,"Sacramento, California"
95,9.0,8.0,9.0,9.0,10.0,58/76,"North Kona growing district, “Big Island” of Hawaii",$38.00/8 ounces,Medium-Light,Hala Tree Kona Coffee,"Captain Cook, Hawaii"
94,9.0,8.0,9.0,9.0,9.0,60/76,"Sidamo (also Sidama) growing region, south-central Ethiopia",$25.00/12 ounces,Medium-Light,modcup coffee,"Jersey City, New Jersey"
94,9.0,8.0,9.0,9.0,9.0,62/80,"Valle del Cauca growing region, Colombia",$30.00/6 ounces,Light,modcup coffee,"Jersey City, New Jersey"
90,,8.0,8.0,8.0,8.0,45/60,Brazil; Guatemala; Ethiopia; Indonesia,NT $300/220 grams,Medium,Atom Coffee Roasters,"Douliou City, Taiwan"
94,9.0,8.0,9.0,9.0,9.0,52/70,"Tobosi, Cartago Province, Costa Rica",NT $450/220 grams,Medium-Light,Atom Coffee Roasters,"Douliou City, Taiwan"
90,8.0,8.0,8.0,8.0,8.0,0/0,Brazil; Bali; Ethiopia,$3.00/sachet (plus one donated),,modcup coffee,"Jersey City, New Jersey"
92,8.0,8.0,,8.0,9.0,0/0,Brazil; Uganda; Colombia; El Salvador; Ethiopia,$18.00/4-12-ounce bottles; 32 ounces/$12; 64-ounces/$20.00,,Magnolia Coffee,"Charlotte, North Carolina"
92,8.0,8.0,,8.0,9.0,0/0,Sumatra; Kenya; Colombia,$46.50/12 9.5-ounce cans,,Equator Coffees,"San Rafael, California"
94,9.0,9.0,,9.0,9.0,0/0,"Ipanema, Brazil",NT $200/150 ml. bottle,,GK Coffee,"Yilan, Taiwan"
93,8.0,8.0,,9.0,9.0,0/0,El Salvador; Brazil,$13.99/Four 8.4-ounce cans,,Topeca Coffee,"Tulsa, Oklahoma"
93,9.0,8.0,,8.0,9.0,0/0,"Guji Zone, Oromia region, southern Ethiopia",$4.59/10.5-ounce bottle,,Stumptown Coffee Roasters,"Portland, Oregon"
93,8.0,8.0,,9.0,9.0,0/0,Colombia; Guatemala,$4.00/12-ounce bottle; $20.00/6-pack,,States Coffee & Mercantile,"Martinez, California"
93,8.0,8.0,,9.0,9.0,0/0,Ethiopia,$20.00/Four 12-ounce bottles,,Klatch Coffee,"Los Angeles, California"
94,9.0,8.0,,9.0,9.0,0/0,"Jimma Zone, Oromia State, Ethiopia",$18.99/50 ounces,,Bonfire Coffee Company,"Carbondale, Colorado"
93,9.0,8.0,,9.0,9.0,0/0,"Yirgacheffe growing region, southern Ethiopia",$4.50/12 ounces,,Collage Coffee,"Grove City, Pennsylvania"
94,9.0,9.0,,8.0,9.0,0/0,"Nyeri growing region, south-central Kenya",$4.00/can,,Four Barrel Coffee,"San Francisco, California"
94,9.0,9.0,,9.0,9.0,0/0,"Guji Zone, Oromia region, southern Ethiopia",$3.99/8-ounce can,,Corvus Coffee Roasters,"Denver, Colorado"
90,8.0,8.0,8.0,8.0,8.0,45/60,Brazil; Costa Rica,$15.95/12 ounces,Medium,RamsHead Coffee Roasters,"Bozeman, Montana"
90,8.0,8.0,8.0,8.0,8.0,50/67,"San Jose, La Paz, Honduras",$15.95/12 ounces,Medium,RamsHead Coffee Roasters,"Bozeman, Montana"
92,8.0,8.0,8.0,9.0,9.0,50/67,"Ahuachapan, El Salvador",$17.95/12 ounces,Medium,RamsHead Coffee Roasters,"Bozeman, Montana"
93,9.0,8.0,9.0,8.0,9.0,58/76,"Agaro Gera, Jimma Zone, Oromia State, Ethiopia",$18.25/12 ounces,Medium-Light,JBC Coffee Roasters,"Madison, Wisconsin"
93,8.0,8.0,9.0,9.0,9.0,56/72,Central Rwanda,$16.95/12 ounces,Medium-Light,Durango Coffee Company,"Durango, Colorado"
94,9.0,8.0,9.0,9.0,9.0,54/72,Ethiopia; Democratic Republic of the Congo,$20.00/12 ounces,Medium-Light,RND & Red Rooster Coffee Roaster,"Roanoke, Virginia and Floyd, Virginia"
94,9.0,8.0,9.0,9.0,9.0,56/72,"Alishan, Chaiyi, Taiwan","NT $1,000/4 ounces",Medium-Light,Kakalove Cafe,"Chia-Yi, Taiwan"
93,9.0,8.0,9.0,8.0,9.0,60/76,"Huila Department, Colombia",$28.00/12 ounces,Medium-Light,Bird Rock Coffee Roasters,"San Diego, California"
94,9.0,8.0,9.0,9.0,9.0,58/74,"Chalatenango, El Salvador",$16.95/6 ounces,Medium-Light,Paradise Roasters,"Minneapolis, Minnesota"
95,9.0,9.0,9.0,9.0,9.0,59/77,"Planadas, Tolima Department, Colombia",$21.00/12 ounces,Medium-Light,JBC Coffee Roasters,"Madison, Wisconsin"
91,,7.0,8.0,8.0,9.0,45/63,Not disclosed,$11.50/12 ounces,Medium,Fieldheads Coffee,"Bigfork, Montana"
93,9.0,8.0,9.0,8.0,9.0,60/76,"Nariño, Colombia",$18.00/12 ounces,Medium-Light,Oak & Bond Coffee Company,"Charlotte, North Carolina"
94,9.0,8.0,9.0,9.0,9.0,58/76,"South Kivu Province, the Democratic Republic of the Congo",$21.00/12 ounces,Medium-Light,Conscious Cup Coffee Roasters,"Crystal Lake, Illinois"
94,9.0,8.0,9.0,9.0,9.0,56/72,"Acevedo, Huila Department, Colombia",$19.00/12 ounces,Medium-Light,Corvus Coffee Roasters,"Denver, Colorado"
95,9.0,9.0,9.0,9.0,9.0,58/76,"Kirinyaga, Kenya",$21.00/12 ounces,Medium-Light,JBC Coffee Roasters,"Madison, Wisconsin"
96,,9.0,9.0,9.0,9.0,58/76,"Kirinyaga, Kenya",$21.00/12 ounces,Medium-Light,JBC Coffee Roasters,"Madison, Wisconsin"
91,,8.0,8.0,8.0,8.0,48/62,El Salvador; Ethiopia; Colombia,$15.95/12 ounces,Medium,RamsHead Coffee Roasters,"Bozeman, Montana"
91,,8.0,8.0,8.0,8.0,43/59,Colombia; Ethiopia; Kenya,NT $350/227 grams,Medium,Choosy Gourmet,"Kaohsiung, Taiwan"
91,8.0,8.0,8.0,8.0,9.0,54/70,"Yunnan Province, China",$15.00/12 ounces,Medium-Light,Baba Java Coffee,"Hoover, Alabama"
92,8.0,8.0,9.0,9.0,8.0,58/72,Ethiopia; Yemen,$18.00/12 ounces,Medium-Light,Baba Java Coffee,"Hoover, Alabama"
93,8.0,8.0,9.0,9.0,9.0,54/70,Yemen,$25.00/8 ounces,Medium-Light,Baba Java Coffee,"Hoover, Alabama"
93,8.0,8.0,9.0,9.0,9.0,60/74,"Guji Zone, Oromia Region, Southern Ethiopia",$18.00/12 ounces,Medium-Light,Atomic Coffee Roasters,"Salem, Massachusetts"
90,8.0,8.0,8.0,8.0,8.0,54/68,"Agaro Gera, Jimma Zone, Oromia Region, Ethiopia",$20.00/12 ounces,Medium-Light,Brain Helmet,"Milwaukee, Wisconsin"
93,9.0,8.0,9.0,8.0,9.0,58/74,"Tlaltetela, Veracruz, Mexico",$17.00/150 grams,Medium-Light,Ilustre Specialty Coffees,"Tijuana, Mexico"
93,9.0,8.0,9.0,8.0,9.0,52/70,"Odo Shakiso District, Guji Zone, Oromia Region, southern Ethiopia",$18.00/12 ounces,Medium-Light,Brain Helmet,"Milwaukee, Wisconsin"
94,9.0,8.0,9.0,9.0,9.0,62/76,"Antioquia Department, northwest Colombia",NT $700/8 ounces,Medium-Light,94 Fresh Coffee,"Kaohsiung City, Taiwan"
93,9.0,8.0,9.0,8.0,9.0,59/77,"Yirgacheffe growing region, south-central Ethiopia",NT $400/220 grams,Medium-Light,Atom Coffee Roasters,"Douliou City, Taiwan"
94,9.0,8.0,9.0,9.0,9.0,62/80,"Guji Zone, Oromia Region, southern Ethiopia",NT $400/8 ounces,Light,David's Nose,"Taipei, Taiwan"
93,8.0,8.0,9.0,9.0,9.0,59/77,"Guji Zone, Oromia Region, Southern Ethiopia",NT $400/222 grams,Medium-Light,Atom Coffee Roasters,"Douliou City, Taiwan"
93,,8.0,9.0,8.0,9.0,47/61,Ethiopia; Colombia; Guatemala,NT $475/250 grams,Medium,Wheelys Café Taiwan,"Taipei, Taiwan"
92,8.0,8.0,9.0,8.0,9.0,54/70,"KwaZulu-Natal province, South Africa",$19.95/2 ounces,Medium-Light,Paradise Roasters,"Minneapolis, Minnesota"
92,8.0,8.0,8.0,9.0,9.0,62/78,"Isla Santa Cruz and Isla San Cristóbal, Galapagos Islands, Ecuador",$19.95/4 ounces,Medium-Light,Paradise Roasters,"Minneapolis, Minnesota"
93,,8.0,8.0,9.0,9.0,50/64,Indonesia; Costa Rica; Brazil,NT $520/250 grams,Medium,Wheelys Cafe Taiwan,"Taipei, Taiwan"
94,9.0,8.0,9.0,9.0,9.0,62/82,"Tolima, Colombia",$19.98/4 ounces,Light,Paradise Roasters,"Minneapolis, Minnesota"
94,9.0,8.0,9.0,9.0,9.0,62/80,"Nueva Segovia, Nicaragua",$19.95/6 ounces,Light,Paradise Roasters,"Minneapolis, Minnesota"
95,9.0,9.0,9.0,9.0,9.0,64/80,"Volcano, Puna District, Big Island of Hawai’i",$29.95/4 ounces,Light,Paradise Roasters,"Minneapolis, Minnesota"
90,7.0,8.0,8.0,9.0,8.0,52/70,"Guji Zone, Oromia Region, Southern Ethiopia",$14.00/12 ounces,Medium-Light,Jackrabbit Java,"Thermopolis, Wyoming"
94,9.0,8.0,9.0,9.0,9.0,54/70,"Yirgacheffe growing region, southern Ethiopia",$14.00/12 ounces,Medium-Light,Jackrabbit Java,"Thermopolis, Wyoming"
94,9.0,8.0,9.0,9.0,9.0,58/74,"Antigua, Guatemala",$19.00/12 ounces,Medium-Light,Conscious Cup Coffee Roasters,"Crystal Lake, Illinois"
93,9.0,8.0,9.0,8.0,9.0,54/72,"Biollet, Costa Rica",$19.98/4 ounces,Medium-Light,Paradise Roasters,"Minneapolis, Minnesota"
92,8.0,8.0,9.0,8.0,9.0,61/86,"Huila, Colombia",$23.00/6 ounces,Light,Dr. Bean's Coffee Roasters,"Memphis, Tennessee"
93,8.0,8.0,9.0,9.0,9.0,56/70,"Sumatra, Indonesia",$18.00/12 ounces,Medium-Light,Southeastern Roastery,"Baltimore, Maryland"
90,7.0,8.0,8.0,8.0,9.0,54/68,"Thiotte, Haiti",$15.00/8 ounces,Medium-Light,Dávila Kafe,"Washington, D.C."
92,9.0,8.0,8.0,8.0,9.0,47/61,"Bungoma region, western Kenya",$19.00/12 ounces,Medium,RND,"Roanoke, Virginia"
92,8.0,8.0,8.0,9.0,9.0,46/62,"Mbeya, Tanzania",$19.00/12 ounces,Medium,Red Bay Coffee,"Oakland, California"
93,9.0,8.0,9.0,8.0,9.0,53/68,"Ka'u growing district, ""Big Island"" of Hawai’i",$19.00/7 ounces,Medium,Rusty's Hawaiian,"Pahala, Hawai'i"
94,9.0,8.0,9.0,9.0,9.0,64/83,"Guji Zone, Oromia Region, Southern Ethiopia",$18.00/12 ounces,Light,Portrait Coffee,"Atlanta, Georgia"
94,9.0,9.0,8.0,9.0,9.0,67/96,"Agaro Gera, Jimma Zone, Oromia Region, Ethiopia",$15.99/12 ounces,Light,Merge Coffee Company,"Harrisonburg, Virginia"
94,9.0,8.0,9.0,9.0,9.0,60/79,"Dipilto, Nicaragua",$15.00/8 ounces,Medium-Light,Dávila Kafe,"Washington, D.C."
94,8.0,8.0,9.0,9.0,9.0,66/85,"Jimma Zone, Oromia State, Ethiopia",$14.00/12 ounces,Light,BLK & Bold,"Des Moines, Iowa"
94,9.0,8.0,9.0,9.0,9.0,60/76,"Suaza, Huila, Colombia",$16.50/12 ounces,Medium-Light,BeanFruit Coffee Co.,"Jackson, Mississippi"
95,9.0,9.0,9.0,9.0,9.0,60/76,"Ngozi Province, Burundi",$20.00/12 ounces,Medium-Light,Boon Boona Coffee,"Renton, Washington"
95,9.0,9.0,9.0,9.0,9.0,60/74,"Sidama growing region, southern Ethiopia",$24.00/16 ounces,Medium-Light,Equiano Coffee,"Eugene, Oregon"
87,7.0,7.0,7.0,8.0,8.0,47/64,Brazil; Guatemala; Indonesia,NT $550/450 grams,Medium,Cafe Arles,"Hsinchu, Taiwan"
93,8.0,8.0,9.0,9.0,9.0,55/77,"Wood Valley, Ka’u, Big Island of Hawai’i",$47.00/12 ounces,Medium-Light,Origin Coffee Roasters,"Kihei, Maui, Hawai'i"
94,9.0,8.0,9.0,9.0,9.0,58/78,"Wood Valley, Ka’u, Big Island of Hawai’i",$50.00/12 ounces,Medium-Light,Origin Coffee Roasters,"Kihei, Maui, Hawaii"
91,8.0,7.0,9.0,8.0,9.0,56/70,"Worka Chelbessa, Gedeb, Ethiopia",$20.00/12 ounces,Medium-Light,Wonderstate Coffee,"Viroqua, Wisconsin"
92,8.0,8.0,9.0,8.0,9.0,54/72,Ethiopia; Peru,$18.00/12 ounces,Medium-Light,Wonderstate Coffee,"Viroqua, Wisconsin"
93,8.0,8.0,9.0,9.0,9.0,60/76,"Yirgacheffe growing region, southern Ethiopia",$18.00/12 ounces,Medium-Light,Wonderstate Coffee,"Viroqua, Wisconsin"
94,9.0,8.0,9.0,9.0,9.0,62/80,"Yirgacheffe growing region, southern Ethiopia",$20.00/12 ounces,Light,Wonderstate Coffee,"Viroqua, Wisconsin"
94,9.0,8.0,9.0,9.0,9.0,58/76,"Guji Zone, Oromia Region, southern Ethiopia",NT $290/8 ounces,Medium-Light,Kakalove Cafe,"Chia-Yi, Taiwan"
96,9.0,9.0,9.0,9.0,10.0,58/78,"Nyeri growing region, south-central Kenya",NT $400/8 ounces,Medium-Light,Kakalove Cafe,"Chia-Yi, Taiwan"
91,8.0,8.0,8.0,8.0,9.0,54/72,"Yirgacheffe growing region, south-central Ethiopia",$16.00/12 ounces,Medium-Light,Indaba Coffee Roasters,"Spokane, Washington"
93,8.0,8.0,9.0,9.0,9.0,58/74,"Guji Zone, Oromia Region, south-central Ethiopia",$16.00/12 ounces,Medium-Light,Indaba Coffee Roasters,"Spokane, Washington"
93,,8.0,9.0,8.0,9.0,50/67,Not disclosed,NT $650/455 grams,Medium,Doho Coffee Roasters,"Caotun, Nantou, Taiwan"
90,8.0,8.0,8.0,8.0,8.0,54/70,"Chiapas, Mexico",$16.99/14 ounces,Medium-Light,Emiliani Coffee,"Minneapolis, Minnesota"
91,8.0,8.0,8.0,8.0,9.0,44/60,"Aceh, Sumatra, Indonesia",$16.99/14 ounces,Medium,Emiliani Coffee,"Minneapolis, Minnesota"
92,8.0,8.0,9.0,8.0,9.0,50/72,Peru,$16.99/14 ounces,Medium-Light,Emiliani Coffee,"Minneapolis, Minnesota"
86,7.0,7.0,7.0,7.0,8.0,46/70,Guatemala,$17.00/12 ounces,Medium,421 Brew House,"Calgary, Alberta, Canada"
90,8.0,8.0,8.0,8.0,8.0,50/76,Rwanda,$17.00/12 ounces,Medium-Light,421 Brew House,"Calgary, Alberta, Canada"
94,9.0,8.0,9.0,9.0,9.0,62/88,"Odo Shakiso District, Guji Zone, southern Ethiopia",$18.49/12 ounces,Light,Red Rooster Coffee Roaster,"Floyd, Virginia"
93,8.0,8.0,9.0,9.0,9.0,54/72,"Cajamarca, Peru",$15.00/12 ounces,Medium-Light,SkyTop Coffee,"Manlius, New York"
94,9.0,8.0,9.0,9.0,9.0,64/92,"Odo Shakiso District, Guji Zone, southern Ethiopia",$18.99/12 ounces,Light,Red Rooster Coffee Roaster,"Floyd, Virginia"
93,9.0,8.0,9.0,8.0,9.0,60/78,"Agaro Gera, Jimma Zone, Oromia State, Ethiopia",$15.00/12 ounces,Medium-Light,SkyTop Coffee,"Manlius, New York"
94,9.0,8.0,9.0,9.0,9.0,58/78,"Embu, Kenya",$23.50/12 ounces,Medium-Light,Temple Coffee Roasters,"Sacramento, California"
94,,8.0,9.0,9.0,9.0,58/80,Ethiopia,$18.49/12 ounces,Medium-Light,Red Rooster Coffee Roaster,"Floyd, Virginia"
94,9.0,8.0,9.0,9.0,9.0,55/73,"Murang'a County, central Kenya",$21.00/12 ounces,Medium-Light,Drink Coffee Do Stuff,"Truckee, California"
95,9.0,9.0,9.0,9.0,9.0,58/78,"Sevilla, San Augustin, Huila, Colombia",$22.00/12 ounces,Medium-Light,JBC Coffee Roasters,"Madison, Wisconsin"
95,9.0,9.0,9.0,9.0,9.0,56/74,"Kirinyaga, Kenya",$21.00/12 ounces,Medium-Light,JBC Coffee Roasters,"Madison, Wisconsin"
94,9.0,8.0,9.0,9.0,9.0,60/76,"Tolima, Colombia",$24.99/10 ounces,Medium-Light,Peach Coffee Roasters,"Johns Creek, Georgia"
94,9.0,8.0,9.0,9.0,9.0,58/76,"Nyeri growing region, south-central Kenya",$24.00/12 ounces,Medium-Light,Dragonfly Coffee Roasters,"Henderson, Nevada"
94,9.0,8.0,9.0,9.0,9.0,58/76,"Yirgacheffe growing region, south-central Ethiopia",$22.00/12 ounces,Medium-Light,Dragonfly Coffee Roasters,"Henderson, Nevada"
92,8.0,8.0,9.0,8.0,9.0,54/72,"Purosa Village, Eastern Highlands, Papua New Guinea",$20.00/16 ounces,Medium-Light,Lamppost Coffee Roasters,"Bonney Lake, Washington"
93,8.0,8.0,9.0,9.0,9.0,56/70,"Sidamo (also Sidama) growing region, south-central Ethiopia",NT $700/230 grams,Medium-Light,Dory Coffee Roasters,"Taipei, Taiwan"
94,9.0,8.0,9.0,9.0,9.0,58/78,"Lintong growing region, North Sumatra Province, Indonesia",NT $450/225 grams,Medium-Light,Peacock Coffee Roaster,"Taipei, Taiwan"
92,8.0,8.0,9.0,8.0,9.0,52/68,"Sabanilla de Alajuela growing region, Costa Rica",$16.95/12 ounces,Medium,Durango Coffee Company,"Durango, Colorado"
93,9.0,8.0,9.0,8.0,9.0,60/76,"Guji Zone, southern Ethiopia",NT $500/8 ounces,Medium-Light,De Clieu Coffee,"Taipei, Taiwan"
92,,9.0,9.0,8.0,8.0,47/62,Ethiopia; Nicaragua; Guatemala,NT $330/16 ounces,Medium,Kakalove Cafe,"Chia-Yi, Taiwan"
93,,8.0,9.0,8.0,9.0,52/70,"Acatenango growing region, central Guatemala",NT $200/8 ounces,Medium-Light,Kakalove Cafe,"Chia-Yi, Taiwan"
93,9.0,8.0,9.0,8.0,9.0,62/80,"Kona, Big Island of Hawai’i",$24.95/12 ounces,Light,Paradise Roasters,"Minneapolis, Minnesota"
94,,8.0,9.0,9.0,9.0,54/70,Colombia; Guatemala; Ethiopia,NT $260/8 ounces,Medium-Light,Kakalove Cafe,"Chia-Yi, Taiwan"
95,9.0,9.0,9.0,9.0,9.0,58/72,"Illubabor Zone, Oromia Region, Ethiopia",$24.95/12 ounces,Medium-Light,Paradise Roasters,"Minneapolis, Minnesota"
92,8.0,8.0,9.0,8.0,9.0,60/76,"Tarrazu growing region, Costa Rica",NT $500/227 grams,Medium-Light,CofFeeling,"Kaohsiung City, Taiwan"
92,8.0,8.0,8.0,9.0,9.0,58/76,"Santa Barbara, Honduras",$21.00/12 ounces,Medium-Light,Per'la Specialty Roasters,"Miami, Florida"
93,8.0,8.0,9.0,9.0,9.0,58/74,"Santa Barbara, Honduras",NT $330/200 grams,Medium-Light,Small Eyes Cafe,"Yilan, Taiwan"
93,9.0,8.0,9.0,8.0,9.0,58/78,"Las Flores, Honduras",$20.00/8 ounces,Medium-Light,Triple Coffee Co.,"San Francisco, California"
93,8.0,8.0,9.0,9.0,9.0,55/71,"Antigua growing region, Guatemala",NT $400/220 grams,Medium-Light,Atom Coffee Roasters,"Douliou City, Taiwan"
93,9.0,8.0,9.0,8.0,9.0,60/76,"Huehuetenango Department, Guatemala",$21.00/12 ounces,Medium-Light,Corvus Coffee Roasters,"Denver, Colorado"
93,9.0,8.0,9.0,8.0,9.0,56/72,"Tecapa Chinameca growing region, El Salvador",$18.00/12 ounces,Medium-Light,Bird Rock Coffee Roasters,"San Diego, California"
92,8.0,8.0,9.0,8.0,9.0,62/80,"Alotepec-Metapan region, El Salvador",$22.99/12 ounces,Light,Red Rooster Coffee Roaster,"Floyd, Virginia"
92,8.0,8.0,9.0,8.0,9.0,62/80,"Chaguites, Honduras",$25.00/6 ounces,Light,Plat Coffee Roastery,"Hong Kong, China"
92,8.0,8.0,8.0,9.0,9.0,54/68,"Bella Vista, Chiapas, Mexico",$16.00/12 ounces,Medium-Light,Mr. Espresso,"Oakland, California"
92,8.0,8.0,9.0,8.0,9.0,50/68,"Santa Ana Department, El Salvador",$24.00/8 ounces,Medium,Equator Coffees,"San Rafael, California"
93,8.0,8.0,9.0,9.0,9.0,58/74,"Huehuetenango Department, Guatemala",$17.99/12 ounces,Medium-Light,Kaldi's Coffee,"St. Louis, Missouri"
93,8.0,8.0,9.0,9.0,9.0,62/80,"Matagalpa, Nicaragua",NT $500/16 ounces,Light,David's Nose,"Taipei, Taiwan"
94,9.0,8.0,9.0,9.0,9.0,54/70,"Chalatenango, El Salvador",NT $500/200 grams,Medium-Light,GK Coffee,"Yilan, Taiwan"
91,8.0,8.0,8.0,8.0,9.0,62/76,"Canton de Desamparados, San Jose, Costa Rica",$17.50/12 ounces,Medium-Light,JBC Coffee Roasters,"Madison, Wisconsin"
92,8.0,8.0,8.0,9.0,9.0,58/76,"Aceh, Sumatra",$19.50/12 ounces,Medium-Light,JBC Coffee Roasters,"Madison, Wisconsin"
94,9.0,8.0,9.0,9.0,9.0,60/78,"Guji Zone, Oromia Region, southern Ethiopia",$18.75/12 ounces,Medium-Light,JBC Coffee Roasters,"Madison, Wisconsin"
91,8.0,8.0,8.0,8.0,9.0,46/60,Not disclosed,$13.95/12 ounces,Medium,Lexington Coffee Roasters,"Lexington, Virginia"
93,,8.0,9.0,8.0,9.0,54/70,"São Sebastião da Grama, Sul de Minas, Brazil",$60.00/30 ounces,Medium-Light,Plat Coffee Roastery,"Hong Kong, China"
94,9.0,8.0,9.0,9.0,9.0,60/78,"Odo Shakiso District, Guji Zone, southern Ethiopia",$19.95/12 ounces,Medium-Light,Lexington Coffee Roasters,"Lexington, Virginia"
94,9.0,8.0,9.0,9.0,9.0,58/78,"Kona, Big Island of Hawai’i",$24.95/4 ounces,Medium-Light,Paradise Roasters,"Minneapolis, Minnesota"
96,9.0,9.0,9.0,9.0,10.0,58/76,"Puna, Big Island of Hawai’i",$29.95/4 ounces,Medium-Light,Paradise Roasters,"Minneapolis, Minnesota"
93,9.0,8.0,9.0,8.0,9.0,60/76,"Tarrazu, Costa RIca",$16.00/10 ounces,Medium-Light,Collage Coffee,"Grove City, Pennsylvania"
92,8.0,8.0,9.0,8.0,9.0,56/72,Brazil; Guatemala; Sumatra,$23.00/12 ounces,Medium-Light,Nostalgia Coffee Roasters,"San Diego, California"
94,9.0,8.0,9.0,9.0,9.0,56/70,"Ka’u growing region, Big island of Hawai’i",$15.00/4 ounces,Medium-Light,Miranda Farms,"Ka'u, Hawaii"
92,8.0,8.0,9.0,8.0,9.0,62/76,"Nueva Segovia, Nicaragua",$12.95/6 ounces,Medium-Light,Paradise Roasters,"Minneapolis, Minnesota"
92,8.0,8.0,9.0,8.0,9.0,58/74,"Buenos Aires, Comayagua, Honduras",$19.00/12 ounces,Medium-Light,Temple Coffee Roasters,"Sacramento, California"
94,9.0,8.0,9.0,9.0,9.0,62/80,"Boquete, Panama",NT $2500/100 grams,Light,Bona Kafo Roastery,"Kaohsiung, Taiwan"
94,,8.0,9.0,9.0,9.0,52/72,"Sidamo (also Sidama) growing region, south-central Ethiopia",NT $550/230 grams,Medium-Light,Bona Kafo Roastery,"Kaohsiung, Taiwan"
94,9.0,8.0,9.0,9.0,9.0,50/68,"Kiambu growing region, south-central Kenya",NT $300/8 ounces,Medium,Kakalove Cafe,"Chia-Yi, Taiwan"
93,,8.0,9.0,8.0,9.0,40/49,"Gedeb District, Gedeo Zone, southern Ethiopia","NT $1,100/8 ounces",Medium-Dark,Simon Hsieh’s Aroma Roast Coffees,"Taoyuan City, Taiwan"
93,9.0,8.0,9.0,8.0,9.0,54/68,Guatemala,"$39.95/8 ounces (packaged as a ""duo"" with the Bourbon Rey Jamaica)",Medium-Light,Paradise Roasters,"Minneapolis, MInnesota"
92,8.0,8.0,9.0,8.0,9.0,50/64,"Valle de Cauca, Colombia",$19.95/8 ounces,Medium,Durango Coffee Company,"Durango, Colorado"
94,9.0,8.0,9.0,9.0,9.0,53/71,"Boquete growing region, western Panama",$12.00/12 ounces,Medium-Light,Jackrabbit Java,"Thermopolis, Wyoming"
94,8.0,9.0,9.0,9.0,9.0,50/70,"Odo Shakiso District, Guji Zone, Oromia region, southern Ethiopia",$21.00/12 ounces,Medium,Lexington Coffee Roasters,"Lexington, Virginia"
93,9.0,8.0,9.0,8.0,9.0,55/74,"Kochere Woreda, Gedeo Zone, southern Ethiopia",$16.40/12 ounces,Medium-Light,JBC Coffee Roasters,"Madison, Wisconsin"
93,8.0,8.0,9.0,9.0,9.0,58/78,"Bururi growing region, Burundi",$16.00/12 ounces,Medium-Light,Flight Coffee Co.,"Bedford, New Hampshire"
93,8.0,8.0,9.0,9.0,9.0,50/70,"Kona growing district, Big Island of Hawai'i",$40.00/8 ounces,Medium,Cafe Virtuoso,"San Diego, California"
87,7.0,7.0,7.0,8.0,8.0,38/52,Colombia,$18.99/2 pounds,Medium-Dark,San Francisco Bay Coffee,"Lincoln, California"
90,8.0,7.0,8.0,8.0,9.0,55/77,"Narino Department, southern Colombia",$15.95/12 ounces,Medium-Light,Lexington Coffee Roasters,"Lexington, Virginia"
90,8.0,8.0,8.0,8.0,8.0,47/55,"Kona growing district, Big Island of Hawaii",$24.00/8 ounces,Medium,Jampot Poorock Abbey,"Eagle Harbor, Michigan"
93,8.0,8.0,9.0,9.0,9.0,54/74,"Sabanilla de Alajuela, Central Valley, Costa Rica",$19.49/12 ounces,Medium-Light,Red Rooster Coffee Roaster,"Floyd, Virginia"
93,8.0,8.0,9.0,9.0,9.0,54/78,"Sidamo (also Sidama) growing region, south-central Ethiopia",$19.00/12 ounces,Medium-Light,Gracenote Coffee Roasters,"Boston, Massachusetts"
93,8.0,8.0,9.0,9.0,9.0,54/78,"Cerrado Mineiro growing region, Santa Luzia, Brazil",$15.00/250 grams,Medium-Light,Coava Coffee Roasters,"Portland, Oregon"
93,8.0,8.0,9.0,9.0,9.0,53/75,"Piedra Candela, Chiriqui Province, far western Panama",$55.00/12 ounces,Medium-Light,Willoughby's Coffee & Tea,"Branford, Connecticut"
90,8.0,8.0,8.0,8.0,8.0,51/71,"Santander, Colombia",$13.95/12 ounces,Medium-Light,Espresso Republic,"Chino, California"
90,,7.0,8.0,8.0,8.0,44/60,"Antioquia, Colombia",$16.95/12 ounces,Medium,Espresso Republic,"Chino, California"
91,,9.0,8.0,8.0,8.0,54/74,"Huila, Colombia",$15.00/12 ounces,Medium-Light,Espresso Republic,"Chino, California"
88,7.0,8.0,7.0,8.0,8.0,0/0,Colombia,$10.99/8 single-serve packets,,Waka Coffee,"Los Angeles, California"
90,,8.0,8.0,8.0,8.0,42/64,Not disclosed,$9.00/8 ounces,Medium,Nella's SOGOOD Coffee,"Empire, Michigan"
91,8.0,8.0,8.0,8.0,9.0,53/73,"Yirgacheffe growing region, southern Ethiopia",$19.00/12 ounces,Medium-Light,Temple Coffee and Tea,"Sacramento, California"
